intent_name,examples,label
retiro_total__procedimiento,¿cómo hago el retiro total de mis cursos?,28
retiro_total__procedimiento,¿puedo realizar el retiro total por correo?,28
retiro_total__procedimiento,por motivos de trabajo deseo dejar todos los cursos,28
retiro_total__procedimiento,el retiro total se hace virtual?,28
retiro_total__procedimiento,"hola, deseo saber qué trámite seguir para el retiro total",28
retiro_total__procedimiento,"hola, tengo que retirarme de todos mis cursos, ¿cómo podria hacerlo?",28
retiro_total__procedimiento,"por motivos familiares, requiero hacer el retiro total de mi matrícula, cual es el procedimiento",28
retiro_total__procedimiento,como puedo solicitar el retiro total de todos los cursos?,28
retiro_total__procedimiento,"buen día, cómo se hace un retiro total",28
retiro_total__procedimiento,"hola, ¿cómo hago el retiro total?",28
retiro_total__procedimiento,"buenas tardes, como realizo un retiro total.gracias.",28
retiro_total__procedimiento,"hola, ¿cómo se inicia el proceso de retiro total?",28
retiro_total__procedimiento,el retiro total se hhace vvirtual ?,28
retiro_total__procedimiento,"quiero acer el retiro total de mis cursos del presete ciclo , quiero saber q documentos se necesitan presentar y q me asegure q no vog a perder mi vacante y que pueda retoma de nuevo las clases en el sigiente ciclo .",28
retiro_total__procedimiento,"buenwo días , que document devo presentar para el proceso de retiro total",28
retiro_total__procedimiento,"buen dia , como se hace un retiro total",28
retiro_total__procedimiento,por motivos de trabqjo deseo dear todos los cursos,28
retiro_total__procedimiento,"ola , ¿ cómo se inicia el proceso de retiro totl ?",28
retiro_total__procedimiento,"buenos días , me beo obligada de retirarme de todos los cursos por motivos de trabajo , cal es el prosedimiento por faavor",28
retiro_total__procedimiento,"hholz , deseo saber qé tramite seguir para el retiro total",28
retiro_total__procedimiento,"ola , ¿ como hago el retiro total ?",28
retiro_total__procedimiento,¿ como hagi el retiro total de mis cursos ?,28
retiro_total__procedimiento,¿ cuales son los pasos para solicitar el ertiro total ?,28
retiro_total__procedimiento,"buennnas , quiero hace el retio total , ¿ podrian ayudarme ?",28
despedida,hasta pronto,0
despedida,adios aerito,0
despedida,nos vemos pronto,0
despedida,"ok, adios",0
despedida,nos vemos aerito,0
despedida,bye,0
despedida,"ok, bye",0
despedida,adiós fue un placer hablar contigo,0
despedida,gracias por la ayuda hasta luego,0
despedida,ya me tengo que ir gracias por la ayuda,0
despedida,hasta luego que tengas buen dia,0
despedida,hasta luego,0
despedida,chau nos vemos,0
despedida,hasta probto,0
despedida,hasta lego,0
despedida,adios aerio,0
despedida,ye,0
despedida,gracias por la ayuda hasta uego,0
despedida,hasta luego q tengas bhne dia,0
despedida,nos emos pronto,0
despedida,ya me tengo que i gracias por la yauda,0
constancia_de_estudios__procedimiento,"he sido eligido para una beca del pronabec pero me estan pidiendo una constancia de estudios, donde puedo tramitarla y cuanto debo pagar",42
constancia_de_estudios__procedimiento,voy a postular a una beca quiero una constancia de estudios,42
constancia_de_estudios__procedimiento,¿cómo solicitar una constancia de estudios?,42
constancia_de_estudios__procedimiento,"hola, una consulta estoy necesitando una constancia de estudios como puedo tramitarla",42
constancia_de_estudios__procedimiento,quisiera una constancia de estudios como la tramito,42
constancia_de_estudios__procedimiento,"hola, me podrias mandar el procedimiento para tramitar una constacia de estudios",42
constancia_de_estudios__procedimiento,"buenas tardes, ¿cuál es el procedimiento para obtener una constancia de estudios?",42
constancia_de_estudios__procedimiento,"buenas noches, quiero saber como tramitar una constancia de estudios",42
constancia_de_estudios__procedimiento,"buenos dias, una duda como puedo tramitar una constancia de estudios",42
constancia_de_estudios__procedimiento,la constnacia de estudios la solicito a la oficina de estadisticas?,42
constancia_de_estudios__procedimiento,"hola, como puedo solicitar una constancia de estudios",42
constancia_de_estudios__procedimiento,para pedir una constancia de estudios solo debo enviar una solicitud o mesa de partes?,42
constancia_de_estudios__procedimiento,"hola que tal, me podria indicar como puedo tramitar una constancia de estudios",42
constancia_de_estudios__procedimiento,hola como puedo tramitar una constancia de estudios,42
constancia_de_estudios__procedimiento,donde puedo solicitar uns constancia de estudios?,42
constancia_de_estudios__procedimiento,a que oficina puedo solicitar una constancia de estudios,42
constancia_de_estudios__procedimiento,me ayudaas quiero solicitar una constancia de estudios pero no se a donde,42
constancia_de_estudios__procedimiento,"ola , como puedo solicitar una constansia de estudios",42
constancia_de_estudios__procedimiento,para pedir una constancia de estudios sool deob enviar una solisitud o mesa de partes ?,42
constancia_de_estudios__procedimiento,¿ cóom solisitar una constancia de estudios ?,42
constancia_de_estudios__procedimiento,me ayudaas quiero solisitar una constancia de etudios pero no se a donde,42
constancia_de_estudios__procedimiento,hola como puedo trahitar una constancia de estudioe,42
constancia_de_estudios__procedimiento,"ola , una consulta estoy necesitando una constansia de estudios cmoo puedo tramitarla",42
constancia_de_estudios__procedimiento,vou a postular a una beca qkiero una constancia de estudios,42
constancia_de_estudios__procedimiento,quisiera una constansia de estidios como la tramito,42
constancia_de_estudios__procedimiento,"hola q tal , me podria indcar como puedo tramriar una constancia de estudios",42
constancia_de_estudios__procedimiento,a que oficina puedo solisitar una constancia de estduioos,42
constancia_de_estudios__procedimiento,donde puedo solisitar uns constansia de estudios ?,42
reincorporacion__procedimiento,"hola, quisiera tramitar mi reicorporacion como puedo proceder como mi matricula",32
reincorporacion__procedimiento,"hola, quiero solicitar mi reincorporación para este periodo cual seria el procedimiento que debo seguir ?",32
reincorporacion__procedimiento,quisiera reincorporarme este ciclo que deberia hacer,32
reincorporacion__procedimiento,el ciclo pasado no me matricula quiero saber si puedo reincorporarme este ciclo,32
reincorporacion__procedimiento,¿cuál es el procedimiento para solicitar reincorporación?,32
reincorporacion__procedimiento,"buenas tardes,le envio este mensaje porque quiero información, el ciclo pasado no pude matricularme pero tampoco hice el trámite de reserva de matricula, quisiera saber si aún puedo realizar el trámite de reincorporación para matricularme o en todo caso como podria reservar mi matricula. por favor agradecería como arreglar este asunto, gracias.",32
reincorporacion__procedimiento,"hola aerito, este ciclo quisiera reincorporarme cual es procedimiento ?",32
reincorporacion__procedimiento,"buenas tardes aerito, el ciclo pasado no puede matricularme quisiera saber si aún puedo realizar el trámte de reincorporación.",32
reincorporacion__procedimiento,"buenas noches, el anterior ciclo reserve mi matricula por motivos familiares , este ciclo si quiero matricularme realizo mi matricula como siempre o hay algun tramite que debo hacer ?",32
reincorporacion__procedimiento,como me puedo reincorporar al siguiente ciclo,32
reincorporacion__procedimiento,cual es el procedimiento para solicitar mi reincorporacion este ciclo,32
reincorporacion__procedimiento,"hola, deseo solicitar mi reincorporación este ciclo que viene como puedo solicitarla",32
reincorporacion__procedimiento,"buenos dias, tengo una duda quiero matricularme este ciclo pero el anterior por motivos de trabajo solicite la reserva de matricula, para realizar mi matricula debo hacer algo adicional ?",32
reincorporacion__procedimiento,"he dejado de estudiar hace año, como podria matricularme en el siguiente ciclo",32
reincorporacion__procedimiento,no pude matricularme el ciclo pasado quisiera que digan como puedo retormar mis estudios este ciclo que viene,32
reincorporacion__procedimiento,buenas tardes me dirijo a ustedes porque quiero incorporarme en el siguiente ciclo,32
reincorporacion__procedimiento,"hola, como solicito mi reincorporacion para este ciclo",32
reincorporacion__procedimiento,"hola, quiero solicitar mi reincorporación para el proximo ciclo que deberia hacer para que me habiliten la matricula",32
reincorporacion__procedimiento,cual es prodimiento de reicorporacion,32
reincorporacion__procedimiento,"hola, como realizo la reincorporación",32
reincorporacion__procedimiento,si tambien quisiera que debaria de hacer luego de la reserva de matricula para reincoporarme el siguiente ciclo,32
reincorporacion__procedimiento,"deje mis estudios hace dos años y quiero retormalo este ciclo, que tramites debo hacer?",32
reincorporacion__procedimiento,podría indicarme ¿cuál es el procedimiento? para solicitar reincorporación,32
reincorporacion__procedimiento,"buenas tardes, el ciclo pasado no pude matricularme asi que reserve mi matricula quisiera saber ahora como puedo matricularme en el ciclo que viene",32
reincorporacion__procedimiento,cual es el proceso para solicitar mi reicorporacion,32
reincorporacion__procedimiento,"buenas tardes aeriot , el ciclo pasado no puede matricularme quiciera saber si ún puedo realisar el trámte de reincorporacion .",32
reincorporacion__procedimiento,quisiera reincorporarme este ciclo qu deberia acer,32
reincorporacion__procedimiento,"hola , como soicito mi reincorporasion para este ciclo",32
reincorporacion__procedimiento,i tmb quiciera que debaria de ahcer luego de la reserva de matricula para reincoporarme el siguiente ciclo,32
reincorporacion__procedimiento,"buennas noches , el anterior ciclo eserve mi matricula por motivos familiares , este ciclo is quiero matrcularme realizi mi matricula como siempre o hay algun tramite qd debo acer ?",32
reincorporacion__procedimiento,"ola aerito , este cicpo quisiera re incorporarme cual es procedimiento ?",32
reincorporacion__procedimiento,¿ cuál es el procedimiento para solisitar reincorproación ?,32
reincorporacion__procedimiento,"buenas tardes , le envio este mensaje porque quiero información , el cclo pasado no pude matricluarme pero tampoco ice el tramite de recerva de matricula , quiciera saber si aún uedo realisar el trámite de reincorporasion para matricularme o en todo csao como podria reservar mi matricula . por favor agradecería como arreglar este asuto , gracias .",32
reincorporacion__procedimiento,"hla , quiero solisitar mi reincorporación para el proximo ciclo qkee deberia hacer para que me hailiten la matricula",32
reincorporacion__procedimiento,"ola , deseo solicitar mi reincorporación este ciclo q viene cooo puedo solicitarla",32
reincorporacion__procedimiento,ccomo me puedo reincorprar al siguiente ciclo,32
reincorporacion__procedimiento,buenas tardes me dirijo a ustddes porqke quiero incorrporarme en el siguiente ciclo,32
reincorporacion__procedimiento,"hola , quero solisitar mi reincroporación para este periodo ucl seria el procedimiento que debo seguir ?",32
reincorporacion__procedimiento,cual es el procedimiento para solisitar mi reincorporaicon este ciclo,32
reincorporacion__procedimiento,el ciclo pasado no me mtaricula quiero saber si upedoo re incorporarme este ciclo,32
reserva_matricula__formato_solicitud,aparte de mi dni y mi codigo que ma debo colocar en la solicitud de reserva de matricula?,31
reserva_matricula__formato_solicitud,la solicitud de reserva de matricula es solo una solicitud simpre dirigida al decano?,31
reserva_matricula__formato_solicitud,puedes decirme donde encuentro un modelo de solicitud para la reserva de matricula ?,31
reserva_matricula__formato_solicitud,puedes decirme si hay algun modelo para la solicitud de reserva de matricula?,31
reserva_matricula__formato_solicitud,hay algun formato para la solicitud de reserva de matricula ?,31
reserva_matricula__formato_solicitud,¿cuál es el modelo de solicitud para la reserva de matricula?,31
reserva_matricula__formato_solicitud,si hay algun formato o modelo para la solicitud de reserva de matricula,31
reserva_matricula__formato_solicitud,si tambien puedes decirme si hay algun formato para la solicitud de reserva de matricula ?,31
reserva_matricula__formato_solicitud,en donde puedo encontar un modelo para la solicitud de reserva de matricula?,31
reserva_matricula__formato_solicitud,que informacion debo colocar en la solicitud para la reserva de matricula?,31
reserva_matricula__formato_solicitud,voy a solicitar mi reserva de matricula pero quiero un modelo para la solicitud que debo enviar,31
reserva_matricula__formato_solicitud,si porfavor mandame el modelo para la solicitud de reserva de matricula,31
reserva_matricula__formato_solicitud,cual es el formato de solicitud para la reserva de matricula ?,31
reserva_matricula__formato_solicitud,tengo un duda cual es el modelo o formato para la solicitud de reserva de matricula,31
reserva_matricula__formato_solicitud,tengo un duda cual es el modeo o formato para la solisitud de resevra de matricula,31
reserva_matricula__formato_solicitud,si ttambien puedes decirme si hay algun formato para la ssolicitud de reserba de matricula ?,31
reserva_matricula__formato_solicitud,¿ cuál es el modelo de solisitud para la reserva de matriccula ?,31
reserva_matricula__formato_solicitud,que informasion debo coloacr en la solisitud para la reserva de matricula ?,31
reserva_matricula__formato_solicitud,si porfavor mandame el modelo para la solicitudd de rdserva de matricuula,31
reserva_matricula__formato_solicitud,cual es el formto de solisitud para la reserva de matricula ?,31
reserva_matricula__formato_solicitud,hay algun formato para la solisitud de recerba de matricula ?,31
reserva_matricula__formato_solicitud,puedes decirme si hay aaglun modelo para la solisitud de recerba de matricula ?,31
reserva_matricula__formato_solicitud,la solicitud de recerba de matricula es solo una solisitud simpre dirigida al ddecano ?,31
matricula__horarios,que turno soy en la matricula?,13
matricula__horarios,donde encuentro mi horario de matricula?,13
matricula__horarios,cuales son los horarios de la matricula?,13
matricula__horarios,cuando es mi hora de matricula,13
matricula__horarios,me podria decir como saber mi horario de matricula.,13
matricula__horarios,quiero saber mi turno para la matricula?,13
matricula__horarios,una consulta como puedo saber a que hora me toca mi matricula?,13
matricula__horarios,si tambien quiero saber mi horario de matricula,13
matricula__horarios,"buenos días, deseo que saber a que hora comienza la matrícula",13
matricula__horarios,y como puedo saber mi horario de matriculas,13
matricula__horarios,"buenas tardes, como puedo saber la hora de mi matrícula",13
matricula__horarios,ya veo tambien quisiera saber  mi horario de matricula.,13
matricula__horarios,ya se publicaron los horarios de la matricula?,13
matricula__horarios,ya estan disponibles los horarios para la matricula?,13
matricula__horarios,a que hora me toca mi matricula,13
matricula__horarios,¿cuál es mi horario de matrícula?,13
matricula__horarios,"buenos días, quisiera información sobre los horarios de matrícula",13
matricula__horarios,me han dicho que la matricula es por horarios como se cuando es el mio,13
matricula__horarios,me podria decir co¿o saber mi horario de matricuula .,13
matricula__horarios,quiero saber mi urno para la mayricula ?,13
matricula__horarios,"uenas tardse , como puedo saber la hora de mi matricula",13
matricula__horarios,una consukta como puedo sabre a q hora me toca mi matricula ?,13
matricula__horarios,¿ cuál es mi horario de matricula ?,13
matricula__horarios,y como puedo saber mi hoario de matricula,13
matricula__horarios,ya se publicaron los horariod de la matricula ?,13
matricula__horarios,a q hkra me toca mi matricula,13
matricula__horarios,donde encuentro mi hoarrio de matrciuula ?,13
matricula__horarios,ya beo tmb quisiera saber   mi horario de matricuula .,13
matricula__horarios,cuales son los horarios de la matrjcula ?,13
matricula__procedimiento_alumno_regular,soy alumno regular como es el proceso de matricula,9
matricula__procedimiento_alumno_regular,soy alumno regular aparte de pagar el autoseguro que mas debo pagar o tramitar para la matricula?,9
matricula__procedimiento_alumno_regular,que pagos debo hacer para la matricula si soy alumno regular,9
matricula__procedimiento_alumno_regular,tengo que hacer algun tramite para matricularme en el segundo ciclo,9
matricula__procedimiento_alumno_regular,cual es procedimiento para la matricula siendo alumno regular,9
matricula__procedimiento_alumno_regular,como alumno regular debo pagar algo mas a parte del autoseguro?,9
matricula__procedimiento_alumno_regular,es mi segundo ciclo que mas pagos debo hacer aparte del autoseguro ?,9
matricula__procedimiento_alumno_regular,es mi segundo ciclo hay algo que debo pagar a parte del autoseguro para la matricula,9
matricula__procedimiento_alumno_regular,una consulta soy alumno regular de matematicas me indicaron que debo hacer unos pagos e ingresar a una plataforma para hacer mi matricula pero no entendi bien,9
matricula__procedimiento_alumno_regular,cuanto pagos debo hacer para la matricula si soy alumno regular,9
matricula__procedimiento_alumno_regular,soy alumno regular como realizo mi matricula,9
matricula__procedimiento_alumno_regular,actualmente soy alumno regular hay algo que debo pagar para la matricula,9
matricula__procedimiento_alumno_regular,no estoy seguro si debo pagar algo mas que el autoseguro para la matricula este ciclo es mi segundo ciclo,9
matricula__procedimiento_alumno_regular,soy alumno de segundo ciclo como me matricula,9
matricula__procedimiento_alumno_regular,soy alumno regular de ciencias de la computación cual es el proceso de matricula,9
matricula__procedimiento_alumno_regular,¿cuál es el proceso de matrícula para un alumno regular?,9
matricula__procedimiento_alumno_regular,cual es el procedimiento de matricula como alumno regular,9
matricula__procedimiento_alumno_regular,que pagos debo hacer este ciclo para la matricula soy alumno regular,9
matricula__procedimiento_alumno_regular,este nuevo ciclo que se esta aperturando la matricula es automatica o debo hacer algun tramite actualmete soy alumno regular,9
matricula__procedimiento_alumno_regular,q pagos debo harcr este ciclo para la matricula soy alumno ergular,9
matricula__procedimiento_alumno_regular,una consultaa soy alumno regular de matemaricas me indicaron q debo acer unos pagos e ingresar a una plataforma para acer mi matricula pero no entendi bien,9
matricula__procedimiento_alumno_regular,soy alumno de swgundo ciclp como me matricula,9
matricula__procedimiento_alumno_regular,es mi segundo ciclo ue mas pagos debo acer aparte del auto seguro ?,9
matricula__procedimiento_alumno_regular,cual es el porcedimiento de mattricula como alumno regular,9
matricula__procedimiento_alumno_regular,soy alumno rgeular aparte de pagar el autosegur q mas debo lgar o tramitar para la matricula ?,9
matricula__procedimiento_alumno_regular,q pagos deo hacer para la matricula si soy alumno relgar,9
matricula__procedimiento_alumno_regular,no estoy seguro sii debo pagar algo mas q el auto seguro para la matriucla este ciclo es mi segundo ciclo,9
matricula__procedimiento_alumno_regular,cual es prosedimiento para la matricula siendo alumno egular,9
matricula__procedimiento_alumno_regular,soy alumno regular de cencias de la computación cuall es el proceso de matricua,9
matricula__procedimiento_alumno_regular,es mi segundo ciclo hay algo q debo pagar a parte del autoseguor para la matricul,9
matricula__procedimiento_alumno_regular,este nnuevo ciclo q se esta aperturando la matricula es automatica o debo haer algun tramite actualmete soy akumno regular,9
confirmar_requerir_mas_ayuda,si me puedes ayudar con esto,3
confirmar_requerir_mas_ayuda,otra duda,3
confirmar_requerir_mas_ayuda,tengo otra consulta,3
confirmar_requerir_mas_ayuda,tengo otra duda,3
confirmar_requerir_mas_ayuda,si una consulta mas,3
confirmar_requerir_mas_ayuda,si una mas,3
confirmar_requerir_mas_ayuda,si una duda mas,3
confirmar_requerir_mas_ayuda,si tengo otra consulta mas,3
confirmar_requerir_mas_ayuda,hay otra constula que tengo,3
confirmar_requerir_mas_ayuda,si,3
confirmar_requerir_mas_ayuda,si tengo otra consulta,3
confirmar_requerir_mas_ayuda,si por favor,3
confirmar_requerir_mas_ayuda,si otra consulta,3
confirmar_requerir_mas_ayuda,si algo mas,3
confirmar_requerir_mas_ayuda,si tenga una consulta,3
confirmar_requerir_mas_ayuda,si hay algo mas con lo que puedes ayudar,3
confirmar_requerir_mas_ayuda,tengo otra cosnulta,3
confirmar_requerir_mas_ayuda,si algo maz,3
confirmar_requerir_mas_ayuda,si una consulta jas,3
confirmar_requerir_mas_ayuda,otra dud,3
confirmar_requerir_mas_ayuda,tengo otra duca,3
confirmar_requerir_mas_ayuda,hay otra consstula que tengo,3
confirmar_requerir_mas_ayuda,s otra consulta,3
confirmar_requerir_mas_ayuda,ssi,3
confirmar_requerir_mas_ayuda,su por favor,3
confirmar_requerir_mas_ayuda,sii tenga una consulta,3
matricula__cronograma,si dime cuales son las fechas de matricula,12
matricula__cronograma,soy ingresante quiero saber cuando es la matricula,12
matricula__cronograma,quiero saber en que fechas se hara la matricula,12
matricula__cronograma,el cronograma de la matricula ya salio?,12
matricula__cronograma,cuando se realizar la matricula el proximo ciclo,12
matricula__cronograma,cual es la fecha de la matricula del siguiente ciclo?,12
matricula__cronograma,"buenos días, deseo que saber cuando comienza la matrícula",12
matricula__cronograma,una consulta ya se publico el cronograma de la matricula?,12
matricula__cronograma,aun no se publican la fechas de la matricula?,12
matricula__cronograma,quiero saber donde esta el cronograma de matricula,12
matricula__cronograma,puedes decirme que dias son la matricula.,12
matricula__cronograma,en el siguiente periodo academico cuando sera la matricula segun el calendario,12
matricula__cronograma,ya se publico las fechas de la matricula?,12
matricula__cronograma,si ya salieron la fechas de la matricula me lo puedes enviar?,12
matricula__cronograma,"si, quiero saber que dias son la matricula",12
matricula__cronograma,"buenas tardes, podria  decirme que dias son las fechas de la matricula",12
matricula__cronograma,hola quiero saber cuando se hara la matricula en el siguiente ciclo,12
matricula__cronograma,"buenas tardes, como puedo saber el día de mi matrícula",12
matricula__cronograma,"si, me puedes decir la fecha de la matricula",12
matricula__cronograma,¿cuando es la matrícula?,12
matricula__cronograma,"buenos días, quiero información sobre la fecha de matrícula",12
matricula__cronograma,"buenas tardes , como puedo sabeer el dia de mi matricula",12
matricula__cronograma,hola quieroo saber cuagdo se hara la matricula en el siguiente icclo,12
matricula__cronograma,"buenos días , quiero información sobre la fecta de matricula",12
matricula__cronograma,cuando se realisar la matricla el proximo ciclo,12
matricula__cronograma,el cronograma de la matricula ya saloi ?,12
matricula__cronograma,soy ingresaante quieroo saber cuando es la matricula,12
matricula__cronograma,una consulta ya se puublico el cronograa de la matricula ?,12
matricula__cronograma,cual es la fechha de la matricula del sguiente ciclo ?,12
matricula__cronograma,quiero ssaber en q fechas se hara la matricula,12
matricula__cronograma,ya se publico las fechas de la magricula ?,12
matricula__cronograma,"is , me puedse decir la fecha de la matricula",12
matricula__cronograma,sk ya salieron la fechas de la matricula me lo puedse enviar ?,12
matricula__cronograma,¿ cuando es la matricula ?,12
reincorporacion__formato_solicitud,estoy buscando el modelo de la solitud de reincorporacion y no lo encuetro puedes decirme donde esta ?,35
reincorporacion__formato_solicitud,debo ponde mi dni en la solcitud de reincorporacion?,35
reincorporacion__formato_solicitud,donde puedo encontrar un modelo para la solicitud de reincorporacion?,35
reincorporacion__formato_solicitud,podria enviarme un modelo para la solicitud de reincorporacion ?,35
reincorporacion__formato_solicitud,no quiero saber cual es el formato para las solicitud de reincorporacion,35
reincorporacion__formato_solicitud,como debe ser la solictud de reincorporacion ?,35
reincorporacion__formato_solicitud,una duda porfavor la solicitud de reincorporacion tiene algun modelo ?,35
reincorporacion__formato_solicitud,el modelo de la solicitud de reincorporacion tambien esta el la pagina de la fc,35
reincorporacion__formato_solicitud,¿hay un modelo para la solicitud de reincorporación?,35
reincorporacion__formato_solicitud,un consulta mas donde podria descargar un modelo o formato para la solicitud de reincorporacion,35
reincorporacion__formato_solicitud,debo colocar mi dni en la solcitud de reincorporacion?,35
reincorporacion__formato_solicitud,un consullta mas donde podria descargar un modelo o formato para la solisitud de reincorporasion,35
reincorporacion__formato_solicitud,donde puedo encontrar un modeio para la solicitud de re incorporacion ?,35
reincorporacion__formato_solicitud,estoy bbusscando el modelo de la solitud de re incorporacion y no lo encuetro puedes decirme onde esta ?,35
reincorporacion__formato_solicitud,una duda porfavor la solisitud de reincorporasion tiene algun modelo ?,35
reincorporacion__formato_solicitud,no quiero saber cual es el formato para las soilcktud de reincorporcion,35
reincorporacion__formato_solicitud,com debe ser la solictud de reincorporacion ?,35
reincorporacion__formato_solicitud,el modelo de la solicitud de reincorporaccion tambien esta el la pagina de la ffv,35
