intent_name,examples,label
retiro_parcial__unico_curso,me he matriculado solo a un curso por que no tenia mas creditos que llavar pero quiero retirma sim embargo el sistema no me esta dejando,22
retiro_parcial__unico_curso,como me retiro si solo llevo un curso,22
retiro_parcial__unico_curso,como me puedo retirar de un curso si es el unico que estoy llevando,22
retiro_parcial__unico_curso,puedo retirarme del curso si solo estoy estoy llevando uno,22
retiro_parcial__unico_curso,si estoy llevando solo un curso como puedo retirarme de ese curso,22
retiro_parcial__unico_curso,actualmente solo me han dejado llevar un curso pero quiero retirarme por motivos de fuerza mayor,22
retiro_parcial__unico_curso,"buenas tardes, actualemte estoy llevando un solo curso pero por motivos de fuerza mayor deseo retirarme pero el sistema no me lo permite, que puedo hacer",22
retiro_parcial__unico_curso,¿el retiro parcial aplica para los estudiantes que llevan solo un curso?,22
retiro_parcial__unico_curso,"estoy matriculado en solo un curso, puedo acceder al retiro parcial?",22
retiro_parcial__unico_curso,solo estoy llevando un curso y me quiero retirar pero el sistema no me lo permite como hago,22
retiro_parcial__unico_curso,la unica asignatura que estoy llevando el la de administracion de redes y quiero retirarme por que no creo poder seguir asistiendo,22
retiro_parcial__unico_curso,"hola, ¿es posible realizar el retiro parcial si estoy llevando un único curso?",22
retiro_parcial__unico_curso,el retiro parcial tmb se aaplica wi solo llevo un curso,22
retiro_parcial__unico_curso,di estoy llevando solo un cursso como puedddo retirarme de ese curso,22
retiro_parcial__unico_curso,"orce no me permmite retirarme del unico cuurso que estoy matriclado , como puedo retirarme ?",22
retiro_parcial__unico_curso,actualmente solo me han deejado lllevar un curso pero quiero retirarme por motiivso de fuerza mayor,22
retiro_parcial__unico_curso,solo estoy llevando un cursso y me quierro retirar pero el sistema no me lo permite ocmo hago,22
retiro_parcial__unico_curso,cmo hago el retiro de un curso si sool llevi ese,22
retiro_parcial__unico_curso,"estoy matriculado en soo un curso , peudo axeder al retiro parcial ?",22
retiro_parcial__unico_curso,como me retio si sloo llevo un curso,22
retiro_parcial__unico_curso,como me puedo retirar de un curso ei es el unico q estoy llevando,22
retiro_parcial__unico_curso,"este ciclo solo pude matricular en un solo urso , pero no cre podder seguir assistinedo y quisiera retirarme",22
retiro_parcial__unico_curso,me he matriculado solo a un curso por qie no tenia maas creditos q llavar pero quiero retirha sim embargo el sistema no me esta djando,22
retiro_parcial__unico_curso,"ola , puedo acer un retiro parcial si solo estoy llevando un urrso",22
retiro_parcial__unico_curso,"bbuenas tardes , actualete estoy llevando un solo curso pero por motivos de fuerza mayor dseeo retirarme pero el sistema no me lo permite , q puedo acer",22
retiro_parcial__unico_curso,"bkenas onches , estoy llevando un olo curso y el sistema no me permite retirarme",22
retiro_parcial__unico_curso,en el caso de sool llevar un curso y quiero retirarme seria retior total o parcial ?,22
reincorporacion__costo,el tramite de reincoporacion se debe pagar o es gratuito?,34
reincorporacion__costo,el tramite de reincoporacion es gratuito o tiene algun costo ?,34
reincorporacion__costo,¿cuánto se pago por reincorporación?,34
reincorporacion__costo,cuanto es el costo por el tramite de reincoporacion?,34
reincorporacion__costo,una consulta se debe pagar algo para el tramite de reincoporacion ?,34
reincorporacion__costo,el tramite de reincorporacion es gratis?,34
reincorporacion__costo,cuanto seria el pago por el tramite de reincoporacion ?,34
reincorporacion__costo,el tramite de reincoporacion tiene alguna costo ?,34
reincorporacion__costo,cuanto pago por la reincoporacion?,34
reincorporacion__costo,cuanto es el costo por la reincoporacion?,34
reincorporacion__costo,soy alumno de la facultad de ciencias que desea matricularse. deje de matricularme algunos semestres por la pandemia y deseo retomar los estudios. me dijeron que debo realizar un pago por el trámite de reincorporación. me gustaría saber ¿en qué entidad bancaria se realiza este pago? y ¿cuánto es el monto?.,34
reincorporacion__costo,"quiero reincorporame este ciclo, el tramite es gratis ?",34
reincorporacion__costo,¿cuánto se paga por el tramite de reincorporación?,34
reincorporacion__costo,se debe pagar algo para la reincoporacion?,34
reincorporacion__costo,cual es precio que tiene el tramite de reincorporacion?,34
reincorporacion__costo,debo pagar algo por la reincoporacion?,34
reincorporacion__costo,"quiero reincorporae este cilo , el tramite es gratis ?",34
reincorporacion__costo,cusnto serai el pago por el tramite de reincoporacion ?,34
reincorporacion__costo,el tramite de re incorporacion es gratis ?,34
reincorporacion__costo,¿ cuánto se paga por el rrmaite de reincorporacion ?,34
reincorporacion__costo,¿ cuáno se pago por reincorporación ?,34
reincorporacion__costo,cuantto es el costo por el tramite de reincoporcion ?,34
reincorporacion__costo,una consulta se ddebe pagar algo para el tramit de reincoporacion ?,34
reincorporacion__costo,el tramite de reincoporacion es grtuito o tiene lgun costo ?,34
reincorporacion__costo,soy alumno de la facultad de ciencias wue desea matricularse . deje de matricularme algunos semestres por la pandemia y deseo retomar los estudioss . me dijeron q debo realizar un pago por el tramite de reincorporación . me gsutaría sabre ¿ en que entidad hancaria se realiza este pago ? y ¿ cunto es el monto ? .,34
reincorporacion__costo,vuanto es el costo por la reincoporacion ?,34
reserva_matricula__procedimiento,¿cómo reservo mi matricula?,29
reserva_matricula__procedimiento,"buenos dias, quisiera realizar reserva de matrícula para este periodo que viene por cuestiones de salud .¿que procedimiento deberia seguir?",29
reserva_matricula__procedimiento,"buenas noches, quisiera saber como puedo hacer una reserva de matricula y ¿hasta cuándo tengo plazo para presentar mi solicitud? ya que este ciclo que viene no podré llevarlo bien por motivos de trabajo.",29
reserva_matricula__procedimiento,"hola, este ciclo no podre matricularme por motivos de salud cual seria el procedimiento para poder reservar la matricula",29
reserva_matricula__procedimiento,que tengo que hacer para reservar mi matricula,29
reserva_matricula__procedimiento,"buenas tardes, quiero postergar mi matricula como puedo hacer ese tramite",29
reserva_matricula__procedimiento,"buenos días, necesito información para solicitar reserva de matrícula?",29
reserva_matricula__procedimiento,quisiera hacer la reserva de matricula cual es el procedimiento,29
reserva_matricula__procedimiento,buenos dias que hago para hacer la reserva de matricula,29
reserva_matricula__procedimiento,mi consulta es como realizar la reserva de mi matricula,29
reserva_matricula__procedimiento,"le escribo porque necesito información, el semestre que viene estaré haciendo un intercambio estudiantil por lo que quisiera saber si necesito hacer algo en la orce ya que este semestre no podré matricularé en la uni. mi escuela ya sabe que haré intercambio y ya les envié el sílabo de los cursos pero aún no tengo respuesta.",29
reserva_matricula__procedimiento,no podre matricular el siguiente ciclo que hago para reservar mi matricula,29
reserva_matricula__procedimiento,"buenas dias, por temas económicos no creo poder matricularme este ciclo me han dicho que puedo reservar mi matricula para el siguiente ciclo como puedo realizar ese tramite",29
reserva_matricula__procedimiento,deseo reservar la matricula como puedo hacer ?,29
reserva_matricula__procedimiento,"buenas, estoy buscando el procedimiento para reservar me puedes decir como encontrarlo",29
reserva_matricula__procedimiento,por motivos económicos no podre matricularme este ciclo como puedo reservar la matricula,29
reserva_matricula__procedimiento,"hola ciencito, queria consultarte lo que pasa es que por temas familiares este ciclo estaba pensando no matricular que debo hacer",29
reserva_matricula__procedimiento,por motivos de encomicos y de trabajo no podre matricularme el siguiente ciclo que puedo hacer para no perder mi vacante,29
reserva_matricula__procedimiento,"buenos dias, quisiera realizar reserva de matrícula para este periodo que viene por cuestiones de trabajo .¿que procedimiento deberia seguir?",29
reserva_matricula__procedimiento,"buenas tardes, tengo una consulta cual es el procedimiento para la reserva de matricula",29
reserva_matricula__procedimiento,por motivos de salud no podre matricularme este ciclo como puedo postergar mi matricula,29
reserva_matricula__procedimiento,cual es el procedimiento para realizar la reserva de matricula ?,29
reserva_matricula__procedimiento,quisiera postergar mi matricula como puedo realizar este tramite,29
reserva_matricula__procedimiento,quisjera postergar mi matricula como puedo realisar este traimte,29
reserva_matricula__procedimiento,por motivs de salud no podre matricularme este cilco como puedo postergar mi mariculw,29
reserva_matricula__procedimiento,deeo reserbar la matricula como puedo hacer ?,29
reserva_matricula__procedimiento,quiciera hacer la reserva de matricula cual es el rpocwdimiento,29
reserva_matricula__procedimiento,"le esccribo porque necesito información , el semestre q veine estaré haciendo un intercambio estudiantil por lo q quiciera eaber si nesesito hacer algo en la orce ya q este semestre no pordé matricularé en la uni . mi escuela ya sabe q haré intercambio y ya les envié el sílabo de los cursos pero aún no tengo respuesta .",29
reserva_matricula__procedimiento,"buneas tardes , tengo una consulta cual es el procedimiento para la recerva de matircula",29
reserva_matricula__procedimiento,cual es el prosedimiento para realisar la reserva de matricula ?,29
reserva_matricula__procedimiento,"buenos dias , quiciera realisar recerva de matrícula para este periodo quee viene por cuestiones de trabajo .¿que procedimient deberia seguir ?",29
reserva_matricula__procedimiento,qek tengo que acer para reservar mi matricula,29
reserva_matricula__procedimiento,"ola ciencito , queria consultarte lo que pasa es q por temas faamiliares este ciclo estaba pensando no matricular q debo acer",29
reserva_matricula__procedimiento,"buenos dias , quisiera realizar reserva de matricula para este ppriodo q vinee por cuestiones de salud .¿que prosedimiento deberia seguir ?",29
reserva_matricula__procedimiento,mi onsluta es como realizar la recerba de mi matricula,29
reserva_matricula__procedimiento,"buenas tardes , quierk postergar mi maricula cpmo puedo hacer ese tramite",29
reserva_matricula__procedimiento,"buenas dias , por temas económicos no crreo poder matricularme este ciclo me han dicho q puedo reserbar mi matricula para el siguiente cicol como puedo realisar ese tramiite",29
constancia_de_notas__formato_solicitud,me puedes enviar un modelo para la solicitud de constancia de notas,40
constancia_de_notas__formato_solicitud,que informacion debo colocar en mi solicitud de constancia de notas?,40
constancia_de_notas__formato_solicitud,me puede facilitar un modelo para la solicitud de constancia de notas si la hubiera,40
constancia_de_notas__formato_solicitud,¿hay algun modelo para la solicitud de constancia de notas?,40
constancia_de_notas__formato_solicitud,donde podria encontar un modelo de solicitud para la constacia de notas,40
constancia_de_notas__formato_solicitud,existe algun modelo o formato para esta solicitud de constancia de notas,40
constancia_de_notas__formato_solicitud,donde un encontra un modelo o formato para esta solicitud,40
constancia_de_notas__formato_solicitud,habria algun modelo o formato para la solicitud de constancia de notas,40
constancia_de_notas__formato_solicitud,no. ¿dónde puedo ver un modelo de la solicitud de constancia de notas?,40
constancia_de_notas__formato_solicitud,donde puedo encontrar el modelo de solicitud para la constancia de notas,40
constancia_de_notas__formato_solicitud,donde pueedo encontrar el modelk de solisitud para la constancia de notas,40
constancia_de_notas__formato_solicitud,me puede facilitar un model para la solicifud de constansia de notas si la hubiera,40
constancia_de_notas__formato_solicitud,q informacion dbo colocar en mi solictiud de constancia de notas ?,40
constancia_de_notas__formato_solicitud,donde un encontra un modelo o formaot para esta solictud,40
constancia_de_notas__formato_solicitud,donde podria encontar un moodelo de solisitud para la constaciaa de notas,40
constancia_de_notas__formato_solicitud,no . ¿ dónde pudeo vwr un modelo de la solisitud de constancia de notas ?,40
retiro_parcial__cursos_repetidos,es posible que haga un retiro parcial de un curso que he repetido?,45
retiro_parcial__cursos_repetidos,quiero retirarme de un curso que llevo por segunda pero el sistema no me deja como hago?,45
retiro_parcial__cursos_repetidos,quero solicitar el retiro de un curso que estoy llevando por segunda vez,45
retiro_parcial__cursos_repetidos,puedo solicitar el retiro de un curso que he repetido el ciclo anterior?,45
retiro_parcial__cursos_repetidos,¿es posible retirarme de un curso que haya repetido?,45
retiro_parcial__cursos_repetidos,puedo retirarme de un curso que haya repetido el ciclo anterior ?,45
retiro_parcial__cursos_repetidos,estoy llevando por segunda el curso de algoritmos pero quisiera retirarme por temas de fuerza mayor como lo puedo hacer?,45
retiro_parcial__cursos_repetidos,estoy intentando retirarme del curso de algebra lineal que estoy llavando por seguna vez pero el sistema no me deja. como puedo solicar retirarme de este curso?,45
retiro_parcial__cursos_repetidos,"quisiera hacer el retiro de un curso pero lo he desaprobado el ciclo, es posible o no procede?",45
retiro_parcial__cursos_repetidos,en el sistema no me deja retirarme del curso de calculo integral es la seguna vez que lo llevo . es por eso?,45
retiro_parcial__cursos_repetidos,es posible retirarme de un curso que estoy llevando por segunda vez?,45
retiro_parcial__cursos_repetidos,quiero saber si puedo solicitar el retiro de un curso que repeti el ciclo pasado?,45
retiro_parcial__cursos_repetidos,"orce no me permite retirarme del curso de calculo avanzado, es por que lo estoy llevando por seguna vez?",45
retiro_parcial__cursos_repetidos,puedo retirarme de una asginatura que he repetido,45
retiro_parcial__cursos_repetidos,quiero retirarme de un curso que he jalado anteriormento como lo solicito?,45
retiro_parcial__cursos_repetidos,estoy llevando un curso por segunda vez y quiero retirarme es posible?,45
retiro_parcial__cursos_repetidos,es posible retirarse de una asignatura que llevo por segunda vez,45
retiro_parcial__cursos_repetidos,puuedo retirarme de un curso q haya repetiod el ciclo anterior ?,45
retiro_parcial__cursos_repetidos,"orce no me permite retirarme del curso de calcuol avanzado , es por q lo estoy llevando por sgeuna vez ?",45
retiro_parcial__cursos_repetidos,quero solisitar el retiro de un curso q estoy llevando por segunda vze,45
retiro_parcial__cursos_repetidos,quiero saberr si puedo solisitar el retiro de un curso q repeti el cic pasado ?,45
retiro_parcial__cursos_repetidos,quiero reyirarme de un curso que llevo por segunda pero el sista no me deja como hhago ?,45
retiro_parcial__cursos_repetidos,"quisiera hacer el retiro de un curso pero lo he desaprobado el cclo , es pozible o no prosede ?",45
retiro_parcial__cursos_repetidos,estoy llevano un curos por segunda vez y quiero retirarme es posiblee ?,45
retiro_parcial__cursos_repetidos,es posible retiarrse de una asignatura q llevo por sebunda vez,45
retiro_parcial__cursos_repetidos,estoy intejtando retirarme del curso de algebra lineal q estoy llavando por seguna vez pero el sistem no me deja . como pueedo solicar retirarme de este urso ?,45
retiro_parcial__cursos_repetidos,es posible q hagz un retiro parcial de un curso q he repetido ?,45
retiro_parcial__cursos_repetidos,pueo solucitar el retiro de un curso qu he repetido el ciclo anterior ?,45
perdida_turno_matricula,no puede matricularme por problemas de internet paso a matricula rezagada entonces ?,16
perdida_turno_matricula,"buenas noches, no he tenido internet todo el dia y no pude matricularme que debo hacer",16
perdida_turno_matricula,"hola, no tuve internet y no pude matricularme que debo hacer",16
perdida_turno_matricula,tuve algunes problemas de red y no pude matricular el sistema ahora ya no me deja que hago,16
perdida_turno_matricula,"hola, no pude entrar en mi turno de matrícula, que puedo hacer",16
perdida_turno_matricula,"buen día, perdí mi horario de matrícula, que hago",16
perdida_turno_matricula,si perdi mi turno de matricula paso a rezagado ?,16
perdida_turno_matricula,acabo de perder mi turno de matricula como me matriculo ahora,16
perdida_turno_matricula,"hola, he tenido problemas de conexion y no llegue a matricularme que debo hacer",16
perdida_turno_matricula,el sistema no me deja matricularme y ya paso mi turno que debo hacer,16
perdida_turno_matricula,"tuve problemas de conexión y no pude entrar en mi horario de matrícula, que puedo hacer",16
perdida_turno_matricula,como puedo realizar mi matricula si ya perdi mi turno?,16
perdida_turno_matricula,"buenas, perdí mi turno de matricula como procedo ahora",16
perdida_turno_matricula,¿como puedo matricularme si perdí mi turno de matricula?,16
perdida_turno_matricula,"buenas que tal, si no llegue a matricularme en mi turno pasaría a rezagado ?",16
perdida_turno_matricula,"hola, quisiera saber que hacer por que no pude matricularme en mi horario no tuve internet",16
perdida_turno_matricula,perdi mi turno de matricula que debo hacer,16
perdida_turno_matricula,perdi mi turno de matricula paso entonces a rezagado?,16
perdida_turno_matricula,"buen día, no logre matricularme",16
perdida_turno_matricula,que pasa si perdí mi horario de matrícula,16
perdida_turno_matricula,no pude matricularme a tiempo y ya paso la matricula que hago,16
perdida_turno_matricula,accabo de perderr mi turno de matricula como me matriculo ahra,16
perdida_turno_matricula,"buenas nohes , no he tenido internet todo el dia y no pude matricularhe que debo acer",16
perdida_turno_matricula,"buenas que tal , sk no llegue a matricularme en mi tuurno pasaría a resagado ?",16
perdida_turno_matricula,que pasa is perdí mi hoario de matrícula,16
perdida_turno_matricula,como pusdo realisar mi matricula si ya perdi mi turnl ?,16
perdida_turno_matricula,si perdi mi turno de matricula passo a rezagado ?,16
perdida_turno_matricula,"hola , no pude entrar en mi tuurno de matrícula , q puedo hacr",16
perdida_turno_matricula,"bun día , perdí mi horario de matricula , q hago",16
perdida_turno_matricula,"no lude matricularme a tie,po y ya paso la matricula q hago",16
perdida_turno_matricula,"ola , he tenido problemas de conexion y no llegue a mtaricularmr que debo acer",16
perdida_turno_matricula,"ola , quisiera saber que hacer por q no pude matricularme en mi hprario no tuve internet",16
perdida_turno_matricula,perdi mi turno de matricula pasao entonces a resagado ?,16
perdida_turno_matricula,no puuede matricularme por prolbemas de internet paso a matricula reagada entonces ?,16
pago_autoseguro_procedimiento,en donde puedo pagar el autoseguro?,15
pago_autoseguro_procedimiento,"buenas tardes, como pago el autoseguro",15
pago_autoseguro_procedimiento,el autoseguro se paga en caja uni?,15
pago_autoseguro_procedimiento,"buenas dias, como hago para pagar el autoseguro",15
pago_autoseguro_procedimiento,cual es el proceso para pagar el autoseguro,15
pago_autoseguro_procedimiento,"buenas, cual es el procedimiento para pagar el autoseguro",15
pago_autoseguro_procedimiento,quiero pagar el autoseguro que debo hacer,15
pago_autoseguro_procedimiento,cual es el metodo para pagar el autoseguro,15
pago_autoseguro_procedimiento,"hola, como pago el autoseguro",15
pago_autoseguro_procedimiento,por que banco que paga el autoseguro,15
pago_autoseguro_procedimiento,puedo pagar el autoseguro en el bcp?,15
pago_autoseguro_procedimiento,el pago de autoseguro se hace en el banco bcp o como,15
pago_autoseguro_procedimiento,"hola que tal, pude decirme como pagar el autoseguro",15
pago_autoseguro_procedimiento,"buenas tardes, como pago el concepto de autoseguro",15
pago_autoseguro_procedimiento,"hola aerito, quiero saber como pagar el autoseguro",15
pago_autoseguro_procedimiento,"buenas, como pago lo del autoseguro",15
pago_autoseguro_procedimiento,para pagar el autoseguro debo emitir orden de pago ?,15
pago_autoseguro_procedimiento,"hola, como puedo realizar el pago del autoseguro",15
pago_autoseguro_procedimiento,entonces como hago para pagar el autoseguro,15
pago_autoseguro_procedimiento,"hola, para pagar el autoseguro que debo hacer",15
pago_autoseguro_procedimiento,"buenas tardes, en que banco pago el autoseguro",15
pago_autoseguro_procedimiento,en que entidad bancaria se puede pagar el autoseguro?,15
pago_autoseguro_procedimiento,el autoseguro se paga en banco scotiabank?,15
pago_autoseguro_procedimiento,en donde y cuanto debo pagar por el autoseguro?,15
pago_autoseguro_procedimiento,puedo pagar el autoseguro por yape?,15
pago_autoseguro_procedimiento,dime que hacer para pagar el autoseguro,15
pago_autoseguro_procedimiento,por favor dime cuanto y adonde debo ir para pagar el autoseguro?,15
pago_autoseguro_procedimiento,el auoseguro se paga en caja nui ?,15
pago_autoseguro_procedimiento,"buenas tardes , omo pago el auto seguro",15
pago_autoseguro_procedimiento,por qeu banco que paaga el autoseguro,15
pago_autoseguro_procedimiento,puedo paar el auto seguro por yape ?,15
pago_autoseguro_procedimiento,"hoa aerito , qjiero saber como pagar el autoseguroo",15
pago_autoseguro_procedimiento,para pagar el autosegjro ebo emitir orden de pago ?,15
pago_autoseguro_procedimiento,"hola , para pppagar el ajtsoeguro que debo hacer",15
pago_autoseguro_procedimiento,en wue entidaad bancaria se puede pagar el autoseguro ?,15
pago_autoseguro_procedimiento,puedk pagar el autoseguro en el fcp ?,15
pago_autoseguro_procedimiento,"buenas tardes , como pgo el concepto de auto seguro",15
pago_autoseguro_procedimiento,cua es el proceso para pagar el auto-seguro,15
pago_autoseguro_procedimiento,entonces comoo hago para pagar el auto-seguro,15
pago_autoseguro_procedimiento,el auto-seguro se paga en banco scotiaban ?,15
pago_autoseguro_procedimiento,cual es el metoo para pagar el auto seguro,15
pago_autoseguro_procedimiento,"benas , cual es el prosedimiento para pagar el autoseguro",15
pago_autoseguro_procedimiento,"buenas dias , xomo hago para pagar el auto-seguro",15
pago_autoseguro_procedimiento,por favor dime cuanto y adoonde debo ir para pagarr el auto seguro ?,15
solicitud_correo_institucional_procedimiento,"hola que tal, todavia no me han dado mi correo uni, a quien puedo pedirle?",44
solicitud_correo_institucional_procedimiento,como tramito mi correo uni,44
solicitud_correo_institucional_procedimiento,a que oficina le solicito mi correo uni,44
solicitud_correo_institucional_procedimiento,donde puedo tramitar mi correo institucional,44
solicitud_correo_institucional_procedimiento,quero pedir mi correo uni,44
solicitud_correo_institucional_procedimiento,aun no tengo mi correo uni en donde lo solicito,44
solicitud_correo_institucional_procedimiento,como solicito mi correo institucional,44
solicitud_correo_institucional_procedimiento,hola como solicito mi correo uni,44
solicitud_correo_institucional_procedimiento,quisiera tramitar mi correo institucional,44
solicitud_correo_institucional_procedimiento,quiero solicitar mi correo uni donde lo pido,44
solicitud_correo_institucional_procedimiento,donde puedo solicitar mi correo institucional,44
solicitud_correo_institucional_procedimiento,a quien puedo perdirle mi correo institucional,44
solicitud_correo_institucional_procedimiento,una pregunta como obtengo mi correo institucional,44
solicitud_correo_institucional_procedimiento,una duda como puedo obtener mi correo institucional,44
solicitud_correo_institucional_procedimiento,"co,o tramito mi correo ui",44
solicitud_correo_institucional_procedimiento,ola como solisito mi correo uni,44
solicitud_correo_institucional_procedimiento,a quien puedo perdrle mi cirreo institucional,44
solicitud_correo_institucional_procedimiento,donde puedo soilcitar mi correo insitucional,44
solicitud_correo_institucional_procedimiento,"ola q tla , todavia no me han dado mi correo uni , a quien puedo pedirle ?",44
solicitud_correo_institucional_procedimiento,una dudaa como puedo obtener mi correeo institucional,44
solicitud_correo_institucional_procedimiento,cmoo solicto mi correo institucional,44
solicitud_correo_institucional_procedimiento,donde pued tramitar mi correo instifuccional,44
solicitud_correo_institucional_procedimiento,quiero solisitar mi corre uni donde lo pido,44
retiro_total__procedimiento,el retiro total es presencial?,28
retiro_total__procedimiento,"buenos días, me veo obligada de retirarme de todos los cursos por motivos de trabajo, cual es el procedimiento por favor",28
retiro_total__procedimiento,"quiero hacer el retiro total, ¿cómo puedo hacerlo?",28
retiro_total__procedimiento,¿cuál es el procedimiento para el retiro total?,28
retiro_total__procedimiento,"quiero hacer el retiro total de mis cursos del presente ciclo, quiero saber que documentos se necesitan presentar y que me asegure que no voy a perder mi vacante y que pueda retomar de nuevo las clases en el siguiente ciclo.",28
retiro_total__procedimiento,"buenos días, que documentos debo presentar para el proceso de retiro total",28
retiro_total__procedimiento,"buenas, quiero hacer el retiro total, ¿podrian ayudarme?",28
retiro_total__procedimiento,¿cuáles son los pasos para solicitar el retiro total?,28
